{
  "record_version": "m5-provisional-completion-0.2",
  "proof_id": "m2-048",
  "run_id": "m5-provisional-batch-m2-048",
  "batch_id": "batch-m2-031-033-035-048",
  "repair_rounds": 1,
  "revalidation_evaluation_ids": [],
  "revalidation_verdicts": [],
  "controller_stop_reason": "irreparable",
  "final_state_digest": "sha256:49eabb0cd68150aea51ff724082b5b9953fadf00bd18a984fbd5026b461cb4a8",
  "replayed_manifest_digest": "sha256:eda9416be1cd05cea811b09b365e58941c87c0eba55aee902f513554dc1f3f63",
  "certificate_digests": [
    "sha256:a365be4f3ffe286785609b8138f8ff6757e8ad3621acc5ba0626c1ab3f7f9711"
  ],
  "formal_real_pilot_gate": "blocked_missing_api_provenance_and_provider_records",
  "person_a_identity_evidence": "conversation_batch_attestation_only"
}
